{
  "schemaVersion": 2,
  "id": "official.shell.reasoning-retry",
  "version": "1.0.2",
  "kind": "declarative",
  "scope": "shell",
  "displayName": "Reasoning Retry Policy",
  "nameKey": "plugin_official_reasoning_retry_name",
  "description": "Retry when a model returns only reasoning content or leaks think-silently text into the final answer.",
  "descriptionKey": "plugin_official_reasoning_retry_description",
  "defaultEnabled": true,
  "permissions": [
    "chat:retry"
  ],
  "activationEvents": ["hook:onResponseError"],
  "compatibility": {
    "versionRange": ">=2.4.86 <3.0.0"
  },
  "publisher": "Cerebr Team",
  "homepage": "https://github.com/yym68686/Cerebr",
  "declarative": {
    "type": "request_policy",
    "retry": {
      "onErrorCodes": [
        "CEREBR_MISFILED_THINK_SILENTLY",
        "CEREBR_REASONING_ONLY_RESPONSE"
      ],
      "maxAttempts": 20,
      "reason": "official:reasoning-retry"
    }
  },
  "contributions": {
    "requestPolicies": [
      {
        "retry": {
          "onErrorCodes": [
            "CEREBR_MISFILED_THINK_SILENTLY",
            "CEREBR_REASONING_ONLY_RESPONSE"
          ],
          "maxAttempts": 20,
          "reason": "official:reasoning-retry"
        }
      }
    ]
  }
}
